{
  "contract": {
    "id": "CT-PRD-001",
    "version": "1.0.0"
  },
  "draft_id": "DRF-2026-000001",
  "request_id": "REQ-2026-000001",
  "plan_id": "PLN-2026-000001",
  "draft_version": "1.0.0",
  "seo_title": "Wi-Fiルーターの電気代はいくら？",
  "meta_description": "電気代の目安と節電方法を解説します。",
  "h1": "Wi-Fiルーターの電気代はいくら？",
  "introduction": "結論を先に説明します。",
  "sections": [
    {
      "heading": "電気代の目安",
      "level": 2,
      "body": "本文"
    }
  ],
  "faq": [],
  "conclusion": "まとめ",
  "internal_links": [],
  "citations": [],
  "unresolved_items": [],
  "status": "ready_for_validation"
}